{
  "id": "com.sienci.storage-test",
  "name": "Storage Test",
  "version": "1.0.0",
  "description": "Tests namespaced persistent key-value plugin storage",
  "author": "Sienci Labs",
  "engine": ">=1.5.0",
  "ui": {
    "entry": "ui/Main.qml",
    "contributions": [
      {
        "slot": "tools-page",
        "label": "Storage Test",
        "icon": "database"
      }
    ]
  },
  "capabilities": {
    "requestTypes": [
      "storage:get",
      "storage:set",
      "storage:delete",
      "storage:get:all",
      "storage:set:all",
      "storage:clear"
    ],
    "topics": []
  }
}
